{"schema_version":"1.1.0","data_classification":"SYNTHETIC_ONLY","binding_id":"SYNTH_BIND_01","patient_uid":"SYNTH_P_001","treatment_episode_id":"SYNTH_EP_01","subject_type":"CLINICAL_OUTCOME","subject_id":"SYNTH_OUTCOME_01","role":"OUTCOME_ASSESSMENT","binding_status":"BLOCKED_UNKNOWN","source_locators":["urn:synthetic:contract-fixture"],"reviewer":null,"reviewed_utc":null,"reason":"Example relationship only; no source adjudication or clinical release."}
